{
  "$schema": "https://gremorie.com/schema/registry-item.json",
  "name": "ng-input-otp",
  "type": "registry:block",
  "framework": "ng",
  "title": "Input OTP (Angular)",
  "description": "One-time password input built on Spartan-ng brain InputOtp - keyboard-driven, paste-friendly, slot-based. Use for 2FA codes, magic links, SMS verification. Mirrors React InputOTP from @gremorie/rx-forms.",
  "categories": [
    "forms"
  ],
  "dependencies": [
    "@angular/core",
    "@spartan-ng/brain",
    "@gremorie/ng-core"
  ],
  "devDependencies": [],
  "registryDependencies": [
    "ng-utils"
  ],
  "files": [
    {
      "path": "src/lib/input-otp/input-otp.ts",
      "content": "import {\n  ChangeDetectionStrategy,\n  Component,\n  computed,\n  Directive,\n  input,\n  ViewEncapsulation,\n} from '@angular/core';\nimport { BrnInputOtpSlot } from '@spartan-ng/brain/input-otp';\nimport { cn } from '@gremorie/ng-core';\n\n// Re-export the brain OTP component so consumers can use `<brn-input-otp grInputOtp>`\n// as the container element (see `InputOtp` below for why it is the element).\nexport { BrnInputOtp } from '@spartan-ng/brain/input-otp';\n\n/**\n * InputOTP — segmented one-time-passcode input. Mirrors React `InputOTP` from\n * `@gremorie/rx-forms`, which is built on the `input-otp` library.\n *\n * The Angular edition wraps the spartan brain `BrnInputOtp` — the Angular\n * equivalent of the `input-otp` `OTPInput`. We use the brain (not a\n * hand-rolled multi-input) because it owns the full OTP contract for free:\n * a single hidden `<input autocomplete=\"one-time-code\">` driving every slot,\n * paste handling, focus tracking, the per-slot `char` / `isActive` /\n * `hasFakeCaret` state, and `ControlValueAccessor` so the component drops into\n * reactive / template-driven forms. That is exactly what the `input-otp`\n * library gives the React version, keeping the two editions at parity.\n *\n * ## React → Angular mapping\n *\n * - React `InputOTP` (the `OTPInput`) = the brain `<brn-input-otp>` element with\n *   our `grInputOtp` directive, which carries `data-slot=\"input-otp\"` and the\n *   React `containerClassName` (`flex items-center gap-2 has-[:disabled]:opacity-50`).\n *   React's `maxLength` / `value` / `disabled` map to the brain's own\n *   `[maxLength]` / `[(value)]` / `[disabled]` inputs on that element.\n * - React `InputOTPGroup` = `gr-input-otp-group` (a `flex items-center` div\n *   carrying `data-slot=\"input-otp-group\"`).\n * - React `InputOTPSlot` = `gr-input-otp-slot`. React reads slot state from\n *   `OTPInputContext`; the brain's `brn-input-otp-slot` already reads it from\n *   the parent `BrnInputOtp` by `index`, renders `{{char}}`, sets\n *   `data-active` on its host, and projects the fake caret only when\n *   `hasFakeCaret`. So we render `<brn-input-otp-slot [index]>` and forward the\n *   React slot class string (which keys off `data-[active=true]`) to it,\n *   projecting the blinking-caret element.\n * - React `InputOTPSeparator` = `gr-input-otp-separator` — a\n *   `role=\"separator\"` carrying the lucide `minus` icon (hand-inlined SVG).\n *\n * Use for 2FA, email/SMS verification codes. Do not use for passwords or\n * persistent PINs — InputOTP is designed for ephemeral codes.\n *\n * @example\n * ```html\n * <brn-input-otp grInputOtp [maxLength]=\"6\" [(value)]=\"code\">\n *   <gr-input-otp-group>\n *     <gr-input-otp-slot [index]=\"0\" />\n *     <gr-input-otp-slot [index]=\"1\" />\n *     <gr-input-otp-slot [index]=\"2\" />\n *   </gr-input-otp-group>\n *   <gr-input-otp-separator />\n *   <gr-input-otp-group>\n *     <gr-input-otp-slot [index]=\"3\" />\n *     <gr-input-otp-slot [index]=\"4\" />\n *     <gr-input-otp-slot [index]=\"5\" />\n *   </gr-input-otp-group>\n * </brn-input-otp>\n * ```\n */\n// InputOtp is a DIRECTIVE applied to the brain's `<brn-input-otp>` element, not\n// a wrapper component. `BrnInputOtp` is a @Component whose OTP-context token is\n// private (not exported by @spartan-ng/brain), so a wrapping `<gr-input-otp>`\n// could not pass that context to `<ng-content>`-projected slots — Angular\n// resolves a projected element's DI from its declaration site, so the slots\n// raised NG0201. Mirrors the spartan reference `hlm-input-otp`\n// (`selector: 'brn-input-otp[hlmInputOtp]'`): the consumer element is\n// `<brn-input-otp grInputOtp …>`, the slots are its real descendants and resolve\n// the OTP context correctly. The brain owns `maxLength` / `value` (`[(value)]`) /\n// `disabled` / `inputId` inputs directly, at parity with React `InputOTP`'s\n// props on the `OTPInput` element.\n@Directive({\n  selector: 'brn-input-otp[grInputOtp]',\n  standalone: true,\n  host: {\n    'data-slot': 'input-otp',\n    '[class]': 'containerClass()',\n  },\n})\nexport class InputOtp {\n  /**\n   * Extra classes for the container. Mirrors React `containerClassName`,\n   * merged with the verbatim React container class string.\n   */\n  readonly containerClassName = input<string>('');\n\n  protected readonly containerClass = computed(() =>\n    cn(\n      'flex items-center gap-2 has-[:disabled]:opacity-50',\n      this.containerClassName(),\n    ),\n  );\n}\n\n/**\n * InputOTPGroup — a visual grouping of adjacent slots. Mirrors React\n * `InputOTPGroup` (a `flex items-center` div).\n */\n@Component({\n  selector: 'gr-input-otp-group',\n  standalone: true,\n  encapsulation: ViewEncapsulation.None,\n  changeDetection: ChangeDetectionStrategy.OnPush,\n  template: `<ng-content />`,\n  host: {\n    'data-slot': 'input-otp-group',\n    '[class]': 'computedClass()',\n  },\n})\nexport class InputOtpGroup {\n  /** Extra classes merged via `cn`. Mirrors React `className`. */\n  readonly class = input<string>('');\n\n  protected readonly computedClass = computed(() =>\n    cn('flex items-center', this.class()),\n  );\n}\n\n/**\n * InputOTPSlot — a single character cell. Mirrors React `InputOTPSlot`.\n *\n * Wraps the brain `brn-input-otp-slot`, which renders `{{char}}`, sets\n * `data-active` on its host, and projects the fake caret only when the slot\n * has one. The React slot class string (which keys off `data-[active=true]`)\n * is forwarded verbatim to the brain slot host via `[class]`, and the blinking\n * caret element is projected.\n */\n@Component({\n  selector: 'gr-input-otp-slot',\n  standalone: true,\n  imports: [BrnInputOtpSlot],\n  encapsulation: ViewEncapsulation.None,\n  changeDetection: ChangeDetectionStrategy.OnPush,\n  template: `\n    <brn-input-otp-slot\n      data-slot=\"input-otp-slot\"\n      [index]=\"index()\"\n      [class]=\"computedClass()\"\n    >\n      <div\n        class=\"pointer-events-none absolute inset-0 flex items-center justify-center\"\n      >\n        <div\n          class=\"h-4 w-px animate-caret-blink bg-foreground duration-1000\"\n        ></div>\n      </div>\n    </brn-input-otp-slot>\n  `,\n})\nexport class InputOtpSlot {\n  /** The slot index this cell represents. Mirrors React `index` (required). */\n  readonly index = input.required<number>();\n  /** Switches to destructive error styling. Mirrors React `aria-invalid`. */\n  readonly ariaInvalid = input<boolean>(false);\n  /** Extra classes merged via `cn`. Mirrors React `className`. */\n  readonly class = input<string>('');\n\n  protected readonly computedClass = computed(() =>\n    cn(\n      'relative flex h-9 w-9 items-center justify-center border-y border-r border-input text-sm shadow-xs transition-all outline-none first:rounded-l-md first:border-l last:rounded-r-md data-[active=true]:z-10 data-[active=true]:border-ring data-[active=true]:ring-[3px] data-[active=true]:ring-ring/50 aria-invalid:border-destructive data-[active=true]:aria-invalid:border-destructive data-[active=true]:aria-invalid:ring-destructive/20 dark:aria-invalid:ring-destructive/40 dark:bg-input/30',\n      this.class(),\n    ),\n  );\n}\n\n/**\n * InputOTPSeparator — a decorative divider between groups. Mirrors React\n * `InputOTPSeparator`, which renders a lucide `MinusIcon`. The icon is\n * hand-inlined as SVG (lucide is unavailable in Angular here).\n */\n@Component({\n  selector: 'gr-input-otp-separator',\n  standalone: true,\n  encapsulation: ViewEncapsulation.None,\n  changeDetection: ChangeDetectionStrategy.OnPush,\n  template: `\n    <svg\n      xmlns=\"http://www.w3.org/2000/svg\"\n      class=\"size-4\"\n      viewBox=\"0 0 24 24\"\n      fill=\"none\"\n      stroke=\"currentColor\"\n      stroke-width=\"2\"\n      stroke-linecap=\"round\"\n      stroke-linejoin=\"round\"\n      aria-hidden=\"true\"\n    >\n      <path d=\"M5 12h14\" />\n    </svg>\n  `,\n  host: {\n    role: 'separator',\n    'data-slot': 'input-otp-separator',\n  },\n})\nexport class InputOtpSeparator {}\n",
      "type": "registry:component",
      "target": "src/app/gremorie/input-otp/input-otp.ts"
    },
    {
      "path": "src/lib/input-otp/index.ts",
      "content": "export {\n  InputOtp,\n  InputOtpGroup,\n  InputOtpSlot,\n  InputOtpSeparator,\n} from './input-otp';\n",
      "type": "registry:lib",
      "target": "src/app/gremorie/input-otp/index.ts"
    }
  ],
  "cssVars": {},
  "usage": {
    "whenToUse": "TBD - document when to use ng-input-otp.",
    "whenNotToUse": "TBD - document when to reach for something else.",
    "bestPractices": [],
    "antipatterns": []
  }
}