{
  "$schema": "https://gremorie.com/schema/registry-item.json",
  "name": "ng-drawer",
  "type": "registry:block",
  "framework": "ng",
  "title": "Drawer (Angular)",
  "description": "Bottom-up sheet for mobile contexts, built on Spartan-ng brain Sheet with a slide-up animation and drag affordance. Best for mobile confirmations, quick actions, simple forms. Mirrors React Drawer (vaul) from @gremorie/rx-overlays.",
  "categories": [
    "overlays"
  ],
  "dependencies": [
    "@angular/core",
    "@spartan-ng/brain",
    "@gremorie/ng-core"
  ],
  "devDependencies": [],
  "registryDependencies": [
    "ng-utils"
  ],
  "files": [
    {
      "path": "src/lib/drawer/drawer.ts",
      "content": "import {\n  ChangeDetectionStrategy,\n  Component,\n  computed,\n  input,\n  ViewEncapsulation,\n} from '@angular/core';\nimport {\n  BrnSheet,\n  BrnSheetClose,\n  BrnSheetDescription,\n  BrnSheetTitle,\n  BrnSheetTrigger,\n} from '@spartan-ng/brain/sheet';\nimport { cn } from '@gremorie/ng-core';\n\ntype DrawerDirection = 'top' | 'bottom' | 'left' | 'right';\n\n/**\n * Drawer â€” bottom-up sheet for mobile contexts. Mirrors React `Drawer` from\n * `@gremorie/rx-overlays`, which is built on `vaul`.\n *\n * Slides up from the bottom by default. Best for mobile confirmations, quick\n * actions, and simple forms. On `md`+ prefer Dialog (focused) or Sheet (longer\n * flow). The recommended responsive pattern is conditional: Drawer below `md`,\n * Dialog or Sheet above.\n *\n * Anatomy: `gn-drawer` (root) â†’ `gn-drawer-trigger` + a\n * `<ng-template brnSheetContent>` wrapping `gn-drawer-content` (which renders\n * the `mx-auto` drag-handle) â†’ `gn-drawer-header` / `gn-drawer-footer` /\n * `gn-drawer-title` / `gn-drawer-description` / `gn-drawer-close`.\n *\n * Divergence vs. React: there is **no Angular `vaul`**. The Angular edition is\n * built on the spartan brain **Sheet** (`BrnSheet`), locked to the requested\n * `direction` via the brain `side` input. Native drag-to-dismiss / momentum\n * gestures from vaul are **not** reproduced. To preserve the React Tailwind\n * class strings verbatim, `gn-drawer-content` sets a\n * `data-vaul-drawer-direction` attribute itself and applies the same\n * `data-[vaul-drawer-direction=...]` and `group/drawer-content` classes â€” so the\n * directional layout and the bottom-only drag-handle visual match React exactly.\n * Default `direction` is `bottom`.\n *\n * @example\n * ```html\n * <gn-drawer direction=\"bottom\">\n *   <button gn-drawer-trigger>Open</button>\n *   <ng-template brnSheetContent>\n *     <gn-drawer-content direction=\"bottom\">\n *       <gn-drawer-header>\n *         <h2 gn-drawer-title>Title</h2>\n *         <p gn-drawer-description>Description</p>\n *       </gn-drawer-header>\n *       <gn-drawer-footer />\n *     </gn-drawer-content>\n *   </ng-template>\n * </gn-drawer>\n * ```\n */\n@Component({\n  selector: 'gn-drawer',\n  standalone: true,\n  hostDirectives: [{ directive: BrnSheet, inputs: ['side'] }],\n  encapsulation: ViewEncapsulation.None,\n  changeDetection: ChangeDetectionStrategy.OnPush,\n  template: `<ng-content />`,\n  host: { 'data-slot': 'drawer', class: 'contents' },\n})\nexport class Drawer {}\n\n/**\n * DrawerTrigger â€” opens the drawer. Mirrors React `DrawerTrigger`. Renders a\n * `<button brnSheetTrigger>` that resolves the ancestor `BrnSheet` via DI.\n */\n@Component({\n  selector: 'gn-drawer-trigger, button[gn-drawer-trigger]',\n  standalone: true,\n  hostDirectives: [BrnSheetTrigger],\n  encapsulation: ViewEncapsulation.None,\n  changeDetection: ChangeDetectionStrategy.OnPush,\n  template: `<ng-content />`,\n  host: { 'data-slot': 'drawer-trigger' },\n})\nexport class DrawerTrigger {}\n\n/**\n * DrawerContent â€” the styled panel + drag handle. Mirrors React\n * `DrawerContent`. Place inside `<ng-template brnSheetContent>`. Renders the\n * `mx-auto` handle that is only visible for the `bottom` direction (matching\n * React's `group-data-[vaul-drawer-direction=bottom]` rule).\n */\n@Component({\n  selector: 'gn-drawer-content',\n  standalone: true,\n  encapsulation: ViewEncapsulation.None,\n  changeDetection: ChangeDetectionStrategy.OnPush,\n  template: `\n    <div\n      class=\"mx-auto mt-4 hidden h-2 w-[100px] shrink-0 rounded-full bg-muted group-data-[vaul-drawer-direction=bottom]/drawer-content:block\"\n    ></div>\n    <ng-content />\n  `,\n  host: {\n    'data-slot': 'drawer-content',\n    '[attr.data-vaul-drawer-direction]': 'direction()',\n    '[class]': 'hostClass()',\n  },\n})\nexport class DrawerContent {\n  readonly class = input<string>();\n  /** Edge the drawer slides from. Mirrors vaul `direction` (default `bottom`). */\n  readonly direction = input<DrawerDirection>('bottom');\n  protected readonly hostClass = computed(() =>\n    cn(\n      'group/drawer-content fixed z-50 flex h-auto flex-col bg-background',\n      'data-[vaul-drawer-direction=top]:inset-x-0 data-[vaul-drawer-direction=top]:top-0 data-[vaul-drawer-direction=top]:mb-24 data-[vaul-drawer-direction=top]:max-h-[80vh] data-[vaul-drawer-direction=top]:rounded-b-lg data-[vaul-drawer-direction=top]:border-b',\n      'data-[vaul-drawer-direction=bottom]:inset-x-0 data-[vaul-drawer-direction=bottom]:bottom-0 data-[vaul-drawer-direction=bottom]:mt-24 data-[vaul-drawer-direction=bottom]:max-h-[80vh] data-[vaul-drawer-direction=bottom]:rounded-t-lg data-[vaul-drawer-direction=bottom]:border-t',\n      'data-[vaul-drawer-direction=right]:inset-y-0 data-[vaul-drawer-direction=right]:right-0 data-[vaul-drawer-direction=right]:w-3/4 data-[vaul-drawer-direction=right]:border-l data-[vaul-drawer-direction=right]:sm:max-w-sm',\n      'data-[vaul-drawer-direction=left]:inset-y-0 data-[vaul-drawer-direction=left]:left-0 data-[vaul-drawer-direction=left]:w-3/4 data-[vaul-drawer-direction=left]:border-r data-[vaul-drawer-direction=left]:sm:max-w-sm',\n      this.class(),\n    ),\n  );\n}\n\n/** DrawerHeader â€” title/description stack. Mirrors React `DrawerHeader`. */\n@Component({\n  selector: 'gn-drawer-header',\n  standalone: true,\n  encapsulation: ViewEncapsulation.None,\n  changeDetection: ChangeDetectionStrategy.OnPush,\n  template: `<ng-content />`,\n  host: {\n    'data-slot': 'drawer-header',\n    '[class]': 'hostClass()',\n  },\n})\nexport class DrawerHeader {\n  readonly class = input<string>();\n  protected readonly hostClass = computed(() =>\n    cn(\n      'flex flex-col gap-0.5 p-4 group-data-[vaul-drawer-direction=bottom]/drawer-content:text-center group-data-[vaul-drawer-direction=top]/drawer-content:text-center md:gap-1.5 md:text-left',\n      this.class(),\n    ),\n  );\n}\n\n/** DrawerFooter â€” bottom-anchored action row. Mirrors React `DrawerFooter`. */\n@Component({\n  selector: 'gn-drawer-footer',\n  standalone: true,\n  encapsulation: ViewEncapsulation.None,\n  changeDetection: ChangeDetectionStrategy.OnPush,\n  template: `<ng-content />`,\n  host: {\n    'data-slot': 'drawer-footer',\n    '[class]': 'hostClass()',\n  },\n})\nexport class DrawerFooter {\n  readonly class = input<string>();\n  protected readonly hostClass = computed(() =>\n    cn('mt-auto flex flex-col gap-2 p-4', this.class()),\n  );\n}\n\n/** DrawerTitle â€” accessible heading. Mirrors React `DrawerTitle`. */\n@Component({\n  selector: 'gn-drawer-title, [gn-drawer-title]',\n  standalone: true,\n  hostDirectives: [BrnSheetTitle],\n  encapsulation: ViewEncapsulation.None,\n  changeDetection: ChangeDetectionStrategy.OnPush,\n  template: `<ng-content />`,\n  host: {\n    'data-slot': 'drawer-title',\n    '[class]': 'hostClass()',\n  },\n})\nexport class DrawerTitle {\n  readonly class = input<string>();\n  protected readonly hostClass = computed(() =>\n    cn('font-semibold text-foreground', this.class()),\n  );\n}\n\n/** DrawerDescription â€” supporting copy. Mirrors React `DrawerDescription`. */\n@Component({\n  selector: 'gn-drawer-description, [gn-drawer-description]',\n  standalone: true,\n  hostDirectives: [BrnSheetDescription],\n  encapsulation: ViewEncapsulation.None,\n  changeDetection: ChangeDetectionStrategy.OnPush,\n  template: `<ng-content />`,\n  host: {\n    'data-slot': 'drawer-description',\n    '[class]': 'hostClass()',\n  },\n})\nexport class DrawerDescription {\n  readonly class = input<string>();\n  protected readonly hostClass = computed(() =>\n    cn('text-sm text-muted-foreground', this.class()),\n  );\n}\n\n/**\n * DrawerClose â€” dismisses the drawer. Mirrors React `DrawerClose`. Renders a\n * `<button brnSheetClose>` for consumer-placed close actions.\n */\n@Component({\n  selector: 'gn-drawer-close, button[gn-drawer-close]',\n  standalone: true,\n  hostDirectives: [BrnSheetClose],\n  encapsulation: ViewEncapsulation.None,\n  changeDetection: ChangeDetectionStrategy.OnPush,\n  template: `<ng-content />`,\n  host: { 'data-slot': 'drawer-close' },\n})\nexport class DrawerClose {}\n",
      "type": "registry:component",
      "target": "src/app/gremorie/drawer/drawer.ts"
    },
    {
      "path": "src/lib/drawer/index.ts",
      "content": "export {\n  Drawer,\n  DrawerClose,\n  DrawerContent,\n  DrawerDescription,\n  DrawerFooter,\n  DrawerHeader,\n  DrawerTitle,\n  DrawerTrigger,\n} from './drawer';\n",
      "type": "registry:lib",
      "target": "src/app/gremorie/drawer/index.ts"
    }
  ],
  "cssVars": {},
  "usage": {
    "whenToUse": "TBD - document when to use ng-drawer.",
    "whenNotToUse": "TBD - document when to reach for something else.",
    "bestPractices": [],
    "antipatterns": []
  }
}