{
  "$schema": "https://gremorie.com/schema/registry-item.json",
  "name": "ng-progress",
  "type": "registry:block",
  "framework": "ng",
  "title": "Progress (Angular)",
  "description": "Determinate progress bar (0-100) wrapping Spartan-ng brain Progress with the Gremorie visual surface. Pass value=null for indeterminate. Mirrors React Progress from @gremorie/rx-feedback.",
  "categories": [
    "feedback",
    "primitives"
  ],
  "dependencies": [
    "@angular/core",
    "@spartan-ng/brain"
  ],
  "devDependencies": [],
  "registryDependencies": [],
  "files": [
    {
      "path": "src/lib/progress/progress.ts",
      "content": "import {\n  ChangeDetectionStrategy,\n  Component,\n  computed,\n  ViewEncapsulation,\n} from '@angular/core';\nimport {\n  BrnProgress,\n  BrnProgressIndicator,\n  injectBrnProgress,\n} from '@spartan-ng/brain/progress';\n\n/**\n * Progress — determinate progress indicator (0-100). Wraps Spartan-ng\n * `BrnProgress` with the Gremorie visual surface. Mirrors React `Progress`\n * from `@gremorie/rx-feedback`.\n *\n * Pass `value` (0-100) for determinate; pass `[value]=\"null\"` for\n * indeterminate (Spartan brain reports `state=\"indeterminate\"`). `max`\n * and `getValueLabel` are also forwarded from Spartan brain.\n *\n * Use Progress when **percent complete is known** — uploads, multi-step\n * forms, batch jobs. For unknown duration, use `Spinner` or `Skeleton`.\n * Always pair the bar with a numeric value or label; silent bars confuse\n * users about the actual state.\n *\n * @example\n * ```html\n * <gr-progress [value]=\"60\" />\n * <gr-progress [value]=\"null\" />\n * <gr-progress [value]=\"3\" [max]=\"5\" />\n * ```\n */\n@Component({\n  selector: 'gr-progress',\n  standalone: true,\n  hostDirectives: [\n    {\n      directive: BrnProgress,\n      inputs: ['value', 'max', 'getValueLabel'],\n    },\n  ],\n  encapsulation: ViewEncapsulation.None,\n  changeDetection: ChangeDetectionStrategy.OnPush,\n  imports: [BrnProgressIndicator],\n  template: `\n    <brn-progress-indicator\n      data-slot=\"progress-indicator\"\n      class=\"block h-full w-full flex-1 bg-primary transition-all\"\n      [style.transform]=\"indicatorTransform()\"\n    />\n  `,\n  host: {\n    'data-slot': 'progress',\n    class:\n      'relative block h-2 w-full overflow-hidden rounded-full bg-primary/20',\n  },\n})\nexport class Progress {\n  private readonly brn = injectBrnProgress();\n\n  protected readonly indicatorTransform = computed(() => {\n    const v = this.brn.value();\n    const max = this.brn.max();\n    const pct = v == null ? 0 : Math.max(0, Math.min(100, (v / max) * 100));\n    return `translateX(-${100 - pct}%)`;\n  });\n}\n",
      "type": "registry:component",
      "target": "src/app/gremorie/progress/progress.ts"
    },
    {
      "path": "src/lib/progress/index.ts",
      "content": "export { Progress } from './progress';\n",
      "type": "registry:lib",
      "target": "src/app/gremorie/progress/index.ts"
    }
  ],
  "cssVars": {},
  "usage": {
    "whenToUse": "Communicating system state to the user — loading (Spinner, Skeleton), progress (Progress) and persistent inline messages (Alert). Companion to Spartan-ng — fills the Spinner gap and wraps Spartan brain Progress idiomatically.",
    "whenNotToUse": "Transient floating notifications belong to a Toast/Sonner primitive. Page-spanning announcements belong to a Banner.",
    "bestPractices": [
      "Pick the right loading affordance: Spinner for unknown duration, Progress for known percent, Skeleton when you need to reserve layout for content shape.",
      "Pair Skeleton-using regions with aria-busy='true' and aria-live='polite' so screen readers announce the loading state.",
      "Convey Alert intent through the leading icon (Info, CheckCircle2, AlertTriangle) rather than introducing new variants."
    ],
    "antipatterns": [
      "Using Skeleton when the geometry of the real content is unknown — the whole point of Skeleton is to prevent layout shift.",
      "Silent Progress bars without a value or label — users do not know the actual state.",
      "Stacking multiple Spinners on one screen — pick one anchored to the slowest operation."
    ],
    "examples": [
      {
        "title": "Inline loading",
        "code": "<button [disabled]=\"loading()\">\n  @if (loading()) { <gr-spinner size=\"sm\" /> }\n  Save\n</button>\n"
      },
      {
        "title": "Determinate upload progress",
        "code": "<gr-progress [value]=\"uploadPct()\" />\n<span>{{ uploadPct() }}%</span>\n"
      },
      {
        "title": "Inline alert",
        "code": "<gr-alert variant=\"destructive\">\n  <gr-alert-title>Saved with errors</gr-alert-title>\n  <gr-alert-description>2 rows failed validation.</gr-alert-description>\n</gr-alert>\n"
      },
      {
        "title": "Skeleton placeholder",
        "code": "<div aria-busy=\"true\" aria-live=\"polite\">\n  <gr-skeleton class=\"h-4 w-32\" />\n  <gr-skeleton class=\"h-4 w-48 mt-2\" />\n</div>\n"
      }
    ]
  }
}