{
  "$schema": "https://gremorie.com/schema/registry-item.json",
  "name": "ng-checkbox",
  "type": "registry:block",
  "framework": "ng",
  "title": "Checkbox (Angular)",
  "description": "Binary checkbox built on Spartan-ng brain Checkbox. Use for multi-select lists, terms acceptance, settings toggles. For mutually exclusive choices use RadioGroup; for on/off use Switch. Mirrors React Checkbox from @gremorie/rx-forms.",
  "categories": [
    "forms"
  ],
  "dependencies": [
    "@angular/core",
    "@spartan-ng/brain",
    "@gremorie/ng-core"
  ],
  "devDependencies": [],
  "registryDependencies": [
    "ng-utils"
  ],
  "files": [
    {
      "path": "src/lib/checkbox/checkbox.ts",
      "content": "import {\n  ChangeDetectionStrategy,\n  Component,\n  computed,\n  effect,\n  input,\n  model,\n  untracked,\n  ViewEncapsulation,\n} from '@angular/core';\nimport { BrnCheckbox } from '@spartan-ng/brain/checkbox';\nimport { cn } from '@gremorie/ng-core';\n\n/** Mirrors React's `boolean | 'indeterminate'` checked union. */\nexport type CheckedState = boolean | 'indeterminate';\n\n/**\n * Checkbox — binary or indeterminate selection control. Mirrors React\n * `Checkbox` from `@gremorie/rx-forms`, which wraps `@radix-ui/react-checkbox`.\n *\n * The Angular edition wraps the spartan brain `BrnCheckbox` — the Angular\n * equivalent of the Radix Checkbox. We use the brain (not a hand-rolled\n * `<button role=\"checkbox\">`) because it ships the full a11y + state contract\n * for free: `role=\"checkbox\"`, `aria-checked` (`true | false | mixed`),\n * `data-state` (`checked | unchecked | indeterminate`), `data-disabled`, focus\n * tracking, and `ControlValueAccessor` so the component drops into reactive /\n * template-driven forms. That is exactly the surface Radix gives the React\n * version, so the brain keeps the two editions at behavioral parity.\n *\n * ## React → Angular mapping\n *\n * - `brn-checkbox` renders its own inner `<button role=\"checkbox\">` and applies\n *   `[class]` + `data-state` to *that button* (the host element is\n *   `display: contents`). So the React `className` (verbatim) is forwarded via\n *   the `[class]` input of `brn-checkbox`, landing on the button exactly where\n *   Radix `Checkbox.Root` puts it. `data-slot=\"checkbox\"` is set on our host.\n * - React's `checked` (`boolean | 'indeterminate'`) is preserved: the `checked`\n *   input accepts that union, and an `indeterminate` model mirrors the\n *   normalized third state. Both are bridged onto the brain's `checked` /\n *   `indeterminate` models with effects, with `checkedChange` re-emitted.\n * - The indicator: React renders the `CheckIcon` inside a Radix `Indicator`\n *   that *only mounts when checked*. `brn-checkbox` instead projects content\n *   unconditionally into its button, so to stay faithful we gate the icon with\n *   `@if (showIndicator())` — visible only when checked or indeterminate. The\n *   icon is the lucide `check` path (lucide is unavailable in Angular here, so\n *   it is hand-inlined as SVG at `size-3.5`, matching React).\n * - Reach for `Checkbox` for form values submitted on submit; reach for\n *   `Switch` when the toggle takes effect immediately.\n *\n * @example\n * ```html\n * <gr-checkbox [(checked)]=\"agreed\" id=\"terms\" />\n * ```\n */\n@Component({\n  selector: 'gr-checkbox',\n  standalone: true,\n  imports: [BrnCheckbox],\n  encapsulation: ViewEncapsulation.None,\n  changeDetection: ChangeDetectionStrategy.OnPush,\n  template: `\n    <brn-checkbox\n      data-slot=\"checkbox\"\n      [class]=\"computedClass()\"\n      [(checked)]=\"brnChecked\"\n      [(indeterminate)]=\"indeterminate\"\n      [id]=\"id() || null\"\n      [name]=\"name() || null\"\n      [disabled]=\"disabled()\"\n      [required]=\"required()\"\n      [aria-label]=\"ariaLabel() || null\"\n      [forceInvalid]=\"ariaInvalid()\"\n    >\n      @if (showIndicator()) {\n        <span\n          data-slot=\"checkbox-indicator\"\n          class=\"grid place-content-center text-current transition-none\"\n        >\n          <svg\n            xmlns=\"http://www.w3.org/2000/svg\"\n            class=\"size-3.5\"\n            viewBox=\"0 0 24 24\"\n            fill=\"none\"\n            stroke=\"currentColor\"\n            stroke-width=\"2\"\n            stroke-linecap=\"round\"\n            stroke-linejoin=\"round\"\n            aria-hidden=\"true\"\n          >\n            <path d=\"M20 6 9 17l-5-5\" />\n          </svg>\n        </span>\n      }\n    </brn-checkbox>\n  `,\n})\nexport class Checkbox {\n  /**\n   * Checked state. Mirrors React `checked` (`boolean | 'indeterminate'`).\n   * Two-way bindable as `[(checked)]`.\n   */\n  readonly checked = model<CheckedState>(false);\n  /** Indeterminate state. Mirrors React `indeterminate` via the union above. */\n  readonly indeterminate = model<boolean>(false);\n  /** Disable interaction. Mirrors React `disabled`. */\n  readonly disabled = input<boolean>(false);\n  /** Required in a form. Mirrors React `required`. */\n  readonly required = input<boolean>(false);\n  /** Element id (for label association). Mirrors React `id`. */\n  readonly id = input<string>('');\n  /** Form control name. Mirrors React `name`. */\n  readonly name = input<string>('');\n  /** Accessible label when no visible label exists. Mirrors React `aria-label`. */\n  readonly ariaLabel = input<string>('');\n  /** Switches to destructive error styling. Mirrors React `aria-invalid`. */\n  readonly ariaInvalid = input<boolean>(false);\n  /** Extra classes merged via `cn`. Mirrors React `className`. */\n  readonly class = input<string>('');\n\n  /** Plain boolean checked state bridged to/from the brain `checked` model. */\n  protected readonly brnChecked = model<boolean>(false);\n\n  /** Whether to render the check indicator (checked OR indeterminate). */\n  protected readonly showIndicator = computed(\n    () => this.checked() === true || this.indeterminate(),\n  );\n\n  /**\n   * The React `Checkbox` class string, verbatim, forwarded to the brain inner\n   * button via `[class]` and merged with any consumer `class`.\n   */\n  protected readonly computedClass = computed(() =>\n    cn(\n      'peer size-4 shrink-0 rounded-[4px] border border-input shadow-xs transition-shadow outline-none focus-visible:border-ring focus-visible:ring-[3px] focus-visible:ring-ring/50 disabled:cursor-not-allowed disabled:opacity-50 aria-invalid:border-destructive aria-invalid:ring-destructive/20 data-[state=checked]:border-primary data-[state=checked]:bg-primary data-[state=checked]:text-primary-foreground dark:bg-input/30 dark:aria-invalid:ring-destructive/40 dark:data-[state=checked]:bg-primary',\n      this.class(),\n    ),\n  );\n\n  constructor() {\n    // Bridge the public union `checked` -> internal boolean for the brain.\n    effect(() => {\n      const c = this.checked();\n      untracked(() => {\n        if (c === 'indeterminate') {\n          if (!this.indeterminate()) this.indeterminate.set(true);\n        } else if (this.brnChecked() !== c) {\n          this.brnChecked.set(c);\n        }\n      });\n    });\n\n    // Bridge the internal boolean back to the public union.\n    effect(() => {\n      const b = this.brnChecked();\n      untracked(() => {\n        if (this.checked() !== b && this.checked() !== 'indeterminate') {\n          this.checked.set(b);\n        }\n      });\n    });\n\n    // When indeterminate flips on, reflect it on the public union.\n    effect(() => {\n      const ind = this.indeterminate();\n      untracked(() => {\n        if (ind && this.checked() !== 'indeterminate') {\n          this.checked.set('indeterminate');\n        }\n      });\n    });\n  }\n}\n",
      "type": "registry:component",
      "target": "src/app/gremorie/checkbox/checkbox.ts"
    },
    {
      "path": "src/lib/checkbox/index.ts",
      "content": "export { Checkbox, type CheckedState } from './checkbox';\n",
      "type": "registry:lib",
      "target": "src/app/gremorie/checkbox/index.ts"
    }
  ],
  "cssVars": {},
  "usage": {
    "whenToUse": "TBD - document when to use ng-checkbox.",
    "whenNotToUse": "TBD - document when to reach for something else.",
    "bestPractices": [],
    "antipatterns": []
  }
}