{
  "$schema": "https://gremorie.com/schema/registry-item.json",
  "name": "ng-label",
  "type": "registry:block",
  "framework": "ng",
  "title": "Label (Angular)",
  "description": "Label primitive for the Angular edition - accessible caption for Input / form controls with disabled-state styling. Mirrors React Label from @gremorie/rx-forms.",
  "categories": [
    "forms"
  ],
  "dependencies": [
    "@angular/core",
    "@gremorie/ng-core"
  ],
  "devDependencies": [],
  "registryDependencies": [
    "ng-utils"
  ],
  "files": [
    {
      "path": "src/lib/label/label.ts",
      "content": "import {\n  ChangeDetectionStrategy,\n  Component,\n  computed,\n  input,\n  ViewEncapsulation,\n} from '@angular/core';\nimport { cn } from '@gremorie/ng-core';\n\n/**\n * Label — accessible label primitive. Mirrors React `Label` from\n * `@gremorie/rx-forms`.\n *\n * The React `Label` wraps Radix `Label.Root`, which is itself just a styled\n * native `<label>` that wires `htmlFor` and pointer/keyboard activation to the\n * associated control. Since there is no Angular Radix dependency, this is a\n * direct 1:1 mapping: a styled native `<label>` carrying `data-slot=\"label\"`\n * and the exact React class string. Standard label semantics already provide\n * the focus-on-click behaviour Radix re-implemented.\n *\n * ## React → Angular mapping\n *\n * - React's `htmlFor` (spread from `Label.Root` props) → `for` signal input,\n *   bound to `[attr.for]`.\n * - React's `children` → projected content via `<ng-content/>`.\n * - React's `className` merge → `class` input merged via `cn`.\n *\n * @example\n * ```html\n * <gr-label for=\"email\">Email</gr-label>\n * <gr-input id=\"email\" type=\"email\" />\n * ```\n */\n@Component({\n  selector: 'gr-label',\n  standalone: true,\n  encapsulation: ViewEncapsulation.None,\n  changeDetection: ChangeDetectionStrategy.OnPush,\n  template: `\n    <label data-slot=\"label\" [class]=\"labelClass()\" [attr.for]=\"for() || null\">\n      <ng-content />\n    </label>\n  `,\n})\nexport class Label {\n  /** Associates the label with a control `id`. Mirrors React `htmlFor`. */\n  readonly for = input<string>('');\n  /** Extra classes merged via `cn`. Mirrors React `className`. */\n  readonly class = input<string>('');\n\n  protected readonly labelClass = computed(() =>\n    cn(\n      'flex items-center gap-2 text-sm leading-none font-medium select-none group-data-[disabled=true]:pointer-events-none group-data-[disabled=true]:opacity-50 peer-disabled:cursor-not-allowed peer-disabled:opacity-50',\n      this.class(),\n    ),\n  );\n}\n",
      "type": "registry:component",
      "target": "src/app/gremorie/label/label.ts"
    },
    {
      "path": "src/lib/label/index.ts",
      "content": "export { Label } from './label';\n",
      "type": "registry:lib",
      "target": "src/app/gremorie/label/index.ts"
    }
  ],
  "cssVars": {},
  "usage": {
    "whenToUse": "TBD - document when to use ng-label.",
    "whenNotToUse": "TBD - document when to reach for something else.",
    "bestPractices": [],
    "antipatterns": []
  }
}