{
  "$schema": "https://gremorie.com/schema/registry-item.json",
  "name": "ng-sheet",
  "type": "registry:block",
  "framework": "ng",
  "title": "Sheet (Angular)",
  "description": "Side-anchored panel for longer flows, built on Spartan-ng brain Sheet with a directional slide animation. Use for filters, settings panels, multi-section edit forms. Mirrors React Sheet from @gremorie/rx-overlays.",
  "categories": [
    "overlays"
  ],
  "dependencies": [
    "@angular/core",
    "@spartan-ng/brain",
    "@gremorie/ng-core"
  ],
  "devDependencies": [],
  "registryDependencies": [
    "ng-utils"
  ],
  "files": [
    {
      "path": "src/lib/sheet/sheet.ts",
      "content": "import {\n  ChangeDetectionStrategy,\n  Component,\n  computed,\n  input,\n  ViewEncapsulation,\n} from '@angular/core';\nimport {\n  BrnSheet,\n  BrnSheetClose,\n  BrnSheetDescription,\n  BrnSheetTitle,\n  BrnSheetTrigger,\n} from '@spartan-ng/brain/sheet';\nimport { cn } from '@gremorie/ng-core';\n\ntype SheetSide = 'top' | 'right' | 'bottom' | 'left';\n\n/**\n * Sheet — side-anchored panel for longer flows. Mirrors React `Sheet` from\n * `@gremorie/rx-overlays`, which wraps Radix Dialog with a directional slide.\n * Behavior is delegated to the spartan brain `BrnSheet` host directive.\n *\n * Use for filters, settings panels, multi-section edit forms — content that\n * does not deserve full focus the way a Dialog does, but is too rich for a\n * Popover. `right` is the default; `left` for navigation; `bottom` for mobile;\n * `top` for global notifications.\n *\n * Anatomy: `gr-sheet` (root, hosts `brnSheet`, takes `side`) →\n * `gr-sheet-trigger` + `<ng-template brnSheetContent>` wrapping\n * `gr-sheet-content` (the styled panel) → `gr-sheet-header` / `gr-sheet-footer`\n * / `gr-sheet-title` / `gr-sheet-description` / `gr-sheet-close`.\n *\n * Divergence vs. React/Radix: brain renders content from a\n * `<ng-template brnSheetContent>` into a CDK overlay. The slide direction lives\n * on the brain `BrnSheet` root (`side` input) — React keeps `side` on\n * `SheetContent`. For class parity, `gr-sheet-content` also takes a `side`\n * input (default `right`) that drives the per-side Tailwind classes verbatim;\n * pass the same `side` to `gr-sheet` so the animation matches. `SheetPortal` /\n * `SheetOverlay` are not exposed as Angular parts (brain owns them).\n *\n * @example\n * ```html\n * <gr-sheet side=\"right\">\n *   <button gr-sheet-trigger>Open</button>\n *   <ng-template brnSheetContent>\n *     <gr-sheet-content side=\"right\">\n *       <gr-sheet-header>\n *         <h2 gr-sheet-title>Title</h2>\n *         <p gr-sheet-description>Description</p>\n *       </gr-sheet-header>\n *     </gr-sheet-content>\n *   </ng-template>\n * </gr-sheet>\n * ```\n */\n@Component({\n  selector: 'gr-sheet',\n  standalone: true,\n  hostDirectives: [{ directive: BrnSheet, inputs: ['side'] }],\n  encapsulation: ViewEncapsulation.None,\n  changeDetection: ChangeDetectionStrategy.OnPush,\n  template: `<ng-content />`,\n  host: { 'data-slot': 'sheet', class: 'contents' },\n})\nexport class Sheet {}\n\n/**\n * SheetTrigger — opens the sheet. Mirrors React `SheetTrigger`. Renders a\n * `<button brnSheetTrigger>` that resolves the ancestor `BrnSheet` via DI.\n */\n@Component({\n  selector: 'gr-sheet-trigger, button[gr-sheet-trigger]',\n  standalone: true,\n  hostDirectives: [BrnSheetTrigger],\n  encapsulation: ViewEncapsulation.None,\n  changeDetection: ChangeDetectionStrategy.OnPush,\n  template: `<ng-content />`,\n  host: { 'data-slot': 'sheet-trigger' },\n})\nexport class SheetTrigger {}\n\n/**\n * SheetContent — the styled side panel. Mirrors React `SheetContent`. Place\n * inside `<ng-template brnSheetContent>`. When `showCloseButton` is true\n * (default) it renders the lucide `X` close button wired to `brnSheetClose`.\n */\n@Component({\n  selector: 'gr-sheet-content',\n  standalone: true,\n  imports: [BrnSheetClose],\n  encapsulation: ViewEncapsulation.None,\n  changeDetection: ChangeDetectionStrategy.OnPush,\n  template: `\n    <ng-content />\n    @if (showCloseButton()) {\n      <button\n        type=\"button\"\n        brnSheetClose\n        class=\"absolute top-4 right-4 rounded-xs opacity-70 ring-offset-background transition-opacity hover:opacity-100 focus:ring-2 focus:ring-ring focus:ring-offset-2 focus:outline-hidden disabled:pointer-events-none data-[state=open]:bg-secondary\"\n      >\n        <svg\n          viewBox=\"0 0 24 24\"\n          fill=\"none\"\n          stroke=\"currentColor\"\n          stroke-width=\"2\"\n          stroke-linecap=\"round\"\n          stroke-linejoin=\"round\"\n          aria-hidden=\"true\"\n          class=\"size-4\"\n        >\n          <path d=\"M18 6 6 18\" />\n          <path d=\"m6 6 12 12\" />\n        </svg>\n        <span class=\"sr-only\">Close</span>\n      </button>\n    }\n  `,\n  host: {\n    'data-slot': 'sheet-content',\n    '[class]': 'hostClass()',\n  },\n})\nexport class SheetContent {\n  readonly class = input<string>();\n  /** Side the panel slides from (drives the per-side classes). Mirrors React `side`. */\n  readonly side = input<SheetSide>('right');\n  /** Whether to render the internal close button. Mirrors React `showCloseButton`. */\n  readonly showCloseButton = input<boolean>(true);\n  protected readonly hostClass = computed(() => {\n    const side = this.side();\n    return cn(\n      'fixed z-50 flex flex-col gap-4 bg-background shadow-lg transition ease-in-out data-[state=closed]:animate-out data-[state=closed]:duration-300 data-[state=open]:animate-in data-[state=open]:duration-500',\n      side === 'right' &&\n        'inset-y-0 right-0 h-full w-3/4 border-l data-[state=closed]:slide-out-to-right data-[state=open]:slide-in-from-right sm:max-w-sm',\n      side === 'left' &&\n        'inset-y-0 left-0 h-full w-3/4 border-r data-[state=closed]:slide-out-to-left data-[state=open]:slide-in-from-left sm:max-w-sm',\n      side === 'top' &&\n        'inset-x-0 top-0 h-auto border-b data-[state=closed]:slide-out-to-top data-[state=open]:slide-in-from-top',\n      side === 'bottom' &&\n        'inset-x-0 bottom-0 h-auto border-t data-[state=closed]:slide-out-to-bottom data-[state=open]:slide-in-from-bottom',\n      this.class(),\n    );\n  });\n}\n\n/** SheetHeader — title/description stack. Mirrors React `SheetHeader`. */\n@Component({\n  selector: 'gr-sheet-header',\n  standalone: true,\n  encapsulation: ViewEncapsulation.None,\n  changeDetection: ChangeDetectionStrategy.OnPush,\n  template: `<ng-content />`,\n  host: {\n    'data-slot': 'sheet-header',\n    '[class]': 'hostClass()',\n  },\n})\nexport class SheetHeader {\n  readonly class = input<string>();\n  protected readonly hostClass = computed(() =>\n    cn('flex flex-col gap-1.5 p-4', this.class()),\n  );\n}\n\n/** SheetFooter — bottom-anchored action row. Mirrors React `SheetFooter`. */\n@Component({\n  selector: 'gr-sheet-footer',\n  standalone: true,\n  encapsulation: ViewEncapsulation.None,\n  changeDetection: ChangeDetectionStrategy.OnPush,\n  template: `<ng-content />`,\n  host: {\n    'data-slot': 'sheet-footer',\n    '[class]': 'hostClass()',\n  },\n})\nexport class SheetFooter {\n  readonly class = input<string>();\n  protected readonly hostClass = computed(() =>\n    cn('mt-auto flex flex-col gap-2 p-4', this.class()),\n  );\n}\n\n/** SheetTitle — accessible heading. Mirrors React `SheetTitle`. */\n@Component({\n  selector: 'gr-sheet-title, [gr-sheet-title]',\n  standalone: true,\n  hostDirectives: [BrnSheetTitle],\n  encapsulation: ViewEncapsulation.None,\n  changeDetection: ChangeDetectionStrategy.OnPush,\n  template: `<ng-content />`,\n  host: {\n    'data-slot': 'sheet-title',\n    '[class]': 'hostClass()',\n  },\n})\nexport class SheetTitle {\n  readonly class = input<string>();\n  protected readonly hostClass = computed(() =>\n    cn('font-semibold text-foreground', this.class()),\n  );\n}\n\n/** SheetDescription — supporting copy. Mirrors React `SheetDescription`. */\n@Component({\n  selector: 'gr-sheet-description, [gr-sheet-description]',\n  standalone: true,\n  hostDirectives: [BrnSheetDescription],\n  encapsulation: ViewEncapsulation.None,\n  changeDetection: ChangeDetectionStrategy.OnPush,\n  template: `<ng-content />`,\n  host: {\n    'data-slot': 'sheet-description',\n    '[class]': 'hostClass()',\n  },\n})\nexport class SheetDescription {\n  readonly class = input<string>();\n  protected readonly hostClass = computed(() =>\n    cn('text-sm text-muted-foreground', this.class()),\n  );\n}\n\n/**\n * SheetClose — dismisses the sheet. Mirrors React `SheetClose`. Renders a\n * `<button brnSheetClose>` for consumer-placed close actions.\n */\n@Component({\n  selector: 'gr-sheet-close, button[gr-sheet-close]',\n  standalone: true,\n  hostDirectives: [BrnSheetClose],\n  encapsulation: ViewEncapsulation.None,\n  changeDetection: ChangeDetectionStrategy.OnPush,\n  template: `<ng-content />`,\n  host: { 'data-slot': 'sheet-close' },\n})\nexport class SheetClose {}\n",
      "type": "registry:component",
      "target": "src/app/gremorie/sheet/sheet.ts"
    },
    {
      "path": "src/lib/sheet/index.ts",
      "content": "export {\n  Sheet,\n  SheetClose,\n  SheetContent,\n  SheetDescription,\n  SheetFooter,\n  SheetHeader,\n  SheetTitle,\n  SheetTrigger,\n} from './sheet';\n",
      "type": "registry:lib",
      "target": "src/app/gremorie/sheet/index.ts"
    }
  ],
  "cssVars": {},
  "usage": {
    "whenToUse": "TBD - document when to use ng-sheet.",
    "whenNotToUse": "TBD - document when to reach for something else.",
    "bestPractices": [],
    "antipatterns": []
  }
}